{
  "$schema": "https://json-schema.org/draft/2020-12/schema",
  "$id": "https://raw.githubusercontent.com/whitespaca/MOSEF/main/schemas/experiment-result-v1.schema.json",
  "title": "MOSEF Experiment Result v1",
  "description": "Immutable metadata and result envelope for a reproducible MOSEF experiment.",
  "type": "object",
  "additionalProperties": false,
  "required": [
    "schema_version",
    "experiment_id",
    "git_commit",
    "timestamp_utc",
    "host",
    "toolchains",
    "algorithm",
    "parameters",
    "seed",
    "input_manifest_sha256",
    "result",
    "timing",
    "peak_memory_bytes",
    "stdout_sha256",
    "status"
  ],
  "properties": {
    "schema_version": {
      "const": "1.0.0"
    },
    "experiment_id": {
      "type": "string",
      "pattern": "^EXP-[0-9]{4,}$"
    },
    "git_commit": {
      "type": "string",
      "pattern": "^[0-9a-f]{40}$"
    },
    "timestamp_utc": {
      "type": "string",
      "format": "date-time"
    },
    "host": {
      "type": "object",
      "additionalProperties": false,
      "required": [
        "os",
        "arch",
        "cpu",
        "logical_cores",
        "memory_bytes"
      ],
      "properties": {
        "os": {
          "type": "string",
          "minLength": 1
        },
        "arch": {
          "type": "string",
          "minLength": 1
        },
        "cpu": {
          "type": "string",
          "minLength": 1
        },
        "logical_cores": {
          "type": "integer",
          "minimum": 1
        },
        "memory_bytes": {
          "type": "integer",
          "minimum": 1
        }
      }
    },
    "toolchains": {
      "type": "object"
    },
    "algorithm": {
      "type": "string",
      "minLength": 1
    },
    "parameters": {
      "type": "object"
    },
    "seed": {
      "type": "string",
      "minLength": 1
    },
    "input_manifest_sha256": {
      "type": "string",
      "pattern": "^[0-9a-f]{64}$"
    },
    "result": {
      "type": "object"
    },
    "timing": {
      "type": "object",
      "additionalProperties": false,
      "required": [
        "wall_seconds",
        "cpu_seconds"
      ],
      "properties": {
        "wall_seconds": {
          "type": "number",
          "minimum": 0
        },
        "cpu_seconds": {
          "type": "number",
          "minimum": 0
        }
      }
    },
    "peak_memory_bytes": {
      "type": [
        "integer",
        "null"
      ],
      "minimum": 0
    },
    "stdout_sha256": {
      "type": "string",
      "pattern": "^[0-9a-f]{64}$"
    },
    "status": {
      "enum": [
        "PASS",
        "FAIL",
        "ERROR",
        "SKIPPED"
      ]
    }
  }
}
